Destination,Month,Category,Score,Options
Beijing,January,Adventure,6,"Great Wall hiking, local tours"
Beijing,January,Cruise,2,"Limited options, some river cruises"
Beijing,January,Winter Sports,5,"Nearby ski resorts, ice skating"
Beijing,January,Gastronomic,9,"Peking duck, hot pot, street food"
Beijing,January,Wellness and Spa,4,Some luxury hotels with spa facilities
Beijing,January,Festival and Events,7,"Chinese New Year preparations, temple fairs"
Beijing,January,Ecotourism,3,"Limited options, some parks and nature reserves"
Beijing,January,Historical and Heritage,10,"Forbidden City, Temple of Heaven, Summer Palace"
Beijing,January,Art and Design,8,"798 Art District, National Art Museum"
Beijing,January,Photography,9,"Iconic landmarks, traditional hutongs, winter scenery"
Beijing,January,Family Fun,6,"Beijing Zoo, amusement parks, cultural experiences"
Beijing,January,Romantic Getaways,5,"Scenic spots, luxury hotels"
Beijing,January,Fitness and Active,6,"Hiking, local gyms, Tai Chi in parks"
Beijing,February,Adventure,6,"Great Wall hiking, local tours"
Beijing,February,Cruise,2,"Limited options, some river cruises"
Beijing,February,Winter Sports,5,"Nearby ski resorts, ice skating"
Beijing,February,Gastronomic,9,"Peking duck, hot pot, street food"
Beijing,February,Wellness and Spa,4,"Limited options, some high-end hotels offer spa services"
Beijing,February,Festival and Events,8,"Chinese New Year celebrations, Lantern Festival"
Beijing,February,Ecotourism,3,"Limited options, some parks and nature reserves"
Beijing,February,Historical and Heritage,10,"Forbidden City, Temple of Heaven, Summer Palace"
Beijing,February,Art and Design,7,"798 Art District, National Art Museum"
Beijing,February,Photography,8,"Historical sites, traditional architecture, winter landscapes"
Beijing,February,Family Fun,6,"Beijing Zoo, parks, museums"
Beijing,February,Romantic Getaways,5,"Scenic spots, some luxury hotels"
Beijing,February,Fitness and Active,6,"Hiking, local gyms, parks for jogging"
Beijing,March,Adventure,6,"Great Wall hiking, local markets exploration"
Beijing,March,Cruise,2,"Limited options, some river cruises available"
Beijing,March,Winter Sports,3,"Limited, some indoor ice skating rinks"
Beijing,March,Gastronomic,9,"Peking duck, street food, diverse culinary experiences"
Beijing,March,Wellness and Spa,5,Some luxury hotels and traditional Chinese medicine centers
Beijing,March,Festival and Events,7,"Lantern Festival, early spring events"
Beijing,March,Ecotourism,4,"Limited, some parks and nature reserves"
Beijing,March,Historical and Heritage,10,"Forbidden City, Temple of Heaven, Summer Palace"
Beijing,March,Art and Design,8,"798 Art District, traditional Chinese art"
Beijing,March,Photography,9,"Iconic landmarks, vibrant street scenes"
Beijing,March,Family Fun,7,"Beijing Zoo, parks, cultural experiences"
Beijing,March,Romantic Getaways,6,"Scenic spots, luxury hotels"
Beijing,March,Fitness and Active,6,"Parks for jogging, local fitness centers"
Beijing,April,Adventure,6,"Great Wall hiking, outdoor parks, and nature reserves"
Beijing,April,Cruise,2,"Limited options, mainly river cruises on the Kunming Lake"
Beijing,April,Winter Sports,0,Not applicable in April
Beijing,April,Gastronomic,9,"Diverse culinary scene, street food, Peking duck, and fine dining"
Beijing,April,Wellness and Spa,7,"Numerous spas, traditional Chinese medicine, and wellness centers"
Beijing,April,Festival and Events,8,"Qingming Festival, Beijing International Film Festival"
Beijing,April,Ecotourism,5,"Parks, botanical gardens, and some eco-friendly tours"
Beijing,April,Historical and Heritage,10,"Forbidden City, Temple of Heaven, Summer Palace, and many more"
Beijing,April,Art and Design,8,"798 Art District, numerous galleries, and traditional crafts"
Beijing,April,Photography,9,"Iconic landmarks, vibrant street scenes, and beautiful spring blossoms"
Beijing,April,Family Fun,7,"Beijing Zoo, amusement parks, and family-friendly museums"
Beijing,April,Romantic Getaways,6,"Scenic spots, romantic walks, and cozy teahouses"
Beijing,April,Fitness and Active,7,"Parks for jogging, cycling, and outdoor fitness activities"
Beijing,May,Adventure,6,"Great Wall hiking, outdoor parks"
Beijing,May,Cruise,2,"Limited options, mainly river cruises"
Beijing,May,Winter Sports,0,Not applicable in May
Beijing,May,Gastronomic,9,"Diverse cuisine, street food, Peking duck"
Beijing,May,Wellness and Spa,5,Some luxury hotels and spas available
Beijing,May,Festival and Events,8,"Dragon Boat Festival, local cultural events"
Beijing,May,Ecotourism,4,"Limited, but some parks and nature reserves"
Beijing,May,Historical and Heritage,10,"Forbidden City, Temple of Heaven, Summer Palace"
Beijing,May,Art and Design,7,"798 Art District, numerous galleries and museums"
Beijing,May,Photography,8,"Iconic landmarks, traditional hutongs, vibrant street scenes"
Beijing,May,Family Fun,7,"Beijing Zoo, amusement parks, educational museums"
Beijing,May,Romantic Getaways,5,"Scenic spots, luxury hotels, but not a primary romantic destination"
Beijing,May,Fitness and Active,6,"Parks, hiking, cycling, but not a primary fitness destination"
Beijing,June,Adventure,6,"Great Wall hiking, outdoor parks"
Beijing,June,Cruise,2,"Limited options, mainly river cruises"
Beijing,June,Winter Sports,0,Not applicable in June
Beijing,June,Gastronomic,9,"Diverse cuisine, street food, Peking duck"
Beijing,June,Wellness and Spa,5,Some luxury hotels and spas
Beijing,June,Festival and Events,7,"Dragon Boat Festival, cultural events"
Beijing,June,Ecotourism,4,"Limited, but some nature parks and reserves"
Beijing,June,Historical and Heritage,10,"Forbidden City, Temple of Heaven, Summer Palace"
Beijing,June,Art and Design,8,"798 Art District, numerous galleries and museums"
Beijing,June,Photography,9,"Iconic landmarks, traditional hutongs, vibrant street scenes"
Beijing,June,Family Fun,7,"Beijing Zoo, amusement parks, museums"
Beijing,June,Romantic Getaways,5,"Scenic spots, but not a primary romantic destination"
Beijing,June,Fitness and Active,6,"Parks, hiking, cycling opportunities"
Beijing,July,Adventure,7,"Great Wall hiking, outdoor activities in parks"
Beijing,July,Cruise,2,"Limited options, mainly river cruises"
Beijing,July,Winter Sports,0,Not applicable in July
Beijing,July,Gastronomic,9,"Diverse culinary scene, street food, Peking duck"
Beijing,July,Wellness and Spa,6,Various spas and wellness centers available
Beijing,July,Festival and Events,8,"Cultural festivals, summer events"
Beijing,July,Ecotourism,5,Some eco-parks and nature reserves
Beijing,July,Historical and Heritage,10,"Forbidden City, Temple of Heaven, Summer Palace"
Beijing,July,Art and Design,8,"798 Art District, numerous galleries and museums"
Beijing,July,Photography,9,"Iconic landmarks, vibrant street scenes"
Beijing,July,Family Fun,7,"Beijing Zoo, amusement parks, educational museums"
Beijing,July,Romantic Getaways,6,"Scenic spots, romantic dining options"
Beijing,July,Fitness and Active,7,"Parks, hiking trails, fitness centers"
Beijing,August,Adventure,6,"Great Wall hiking, mountain biking, and exploring natural parks"
Beijing,August,Cruise,2,"Limited options, mainly river cruises on the nearby waterways"
Beijing,August,Winter Sports,0,Not applicable in August
Beijing,August,Gastronomic,9,"Renowned for diverse and delicious cuisine, including Peking Duck"
Beijing,August,Wellness and Spa,5,Some luxury hotels and spas available
Beijing,August,Festival and Events,7,"Various cultural festivals and events, including the Beijing International Film Festival"
Beijing,August,Ecotourism,4,"Some eco-friendly tours and parks, but not a primary focus"
Beijing,August,Historical and Heritage,10,"Rich in historical sites like the Forbidden City, Temple of Heaven, and the Great Wall"
Beijing,August,Art and Design,8,"Numerous art galleries, museums, and contemporary art districts"
Beijing,August,Photography,9,Iconic landmarks and vibrant street scenes offer excellent photo opportunities
Beijing,August,Family Fun,7,"Attractions like Beijing Zoo, amusement parks, and educational museums"
Beijing,August,Romantic Getaways,5,"Some romantic spots, but not a primary destination for couples"
Beijing,August,Fitness and Active,6,"Plenty of parks and outdoor activities, including Tai Chi in public spaces"
Beijing,September,Adventure,6,"Great Wall hiking, biking tours, and outdoor activities in parks"
Beijing,September,Cruise,2,"Limited options, mainly river cruises on the nearby waterways"
Beijing,September,Winter Sports,0,Not applicable in September
Beijing,September,Gastronomic,9,"Diverse culinary scene, street food, Peking duck, and high-end dining"
Beijing,September,Wellness and Spa,5,Some luxury hotels and spas available
Beijing,September,Festival and Events,7,"Mid-Autumn Festival, cultural performances, and local events"
Beijing,September,Ecotourism,4,"Limited, but some parks and nature reserves nearby"
Beijing,September,Historical and Heritage,10,"Forbidden City, Temple of Heaven, Summer Palace, and many more"
Beijing,September,Art and Design,8,"798 Art District, numerous galleries, and traditional crafts"
Beijing,September,Photography,9,"Iconic landmarks, historical sites, and vibrant street scenes"
Beijing,September,Family Fun,7,"Beijing Zoo, amusement parks, and family-friendly attractions"
Beijing,September,Romantic Getaways,6,"Scenic spots, luxury hotels, and romantic dining options"
Beijing,September,Fitness and Active,6,"Parks, hiking, biking, and fitness centers"
Beijing,October,Adventure,6,"Great Wall hiking, mountain biking, and exploring natural parks"
Beijing,October,Cruise,2,"Limited options, mainly river cruises on the nearby waterways"
Beijing,October,Winter Sports,1,"Not applicable in October, as winter sports season hasn't started yet"
Beijing,October,Gastronomic,9,"Rich culinary scene with Peking duck, street food, and diverse cuisine"
Beijing,October,Wellness and Spa,5,Some high-end hotels and resorts offer good wellness and spa facilities
Beijing,October,Festival and Events,8,"Mid-Autumn Festival, National Day celebrations, and various cultural events"
Beijing,October,Ecotourism,4,Limited but some options in nearby natural reserves and parks
Beijing,October,Historical and Heritage,10,"Forbidden City, Temple of Heaven, Summer Palace, and numerous other sites"
Beijing,October,Art and Design,7,"798 Art District, various museums, and contemporary art galleries"
Beijing,October,Photography,8,"Iconic landmarks, autumn foliage, and vibrant street scenes"
Beijing,October,Family Fun,7,"Beijing Zoo, amusement parks, and family-friendly attractions"
Beijing,October,Romantic Getaways,6,Scenic spots like Beihai Park and romantic dining options
Beijing,October,Fitness and Active,6,"Plenty of parks, hiking trails, and fitness centers"
Beijing,November,Adventure,6,"Great Wall hiking, local tours"
Beijing,November,Cruise,2,"Limited options, some river cruises"
Beijing,November,Winter Sports,3,"Limited, some nearby ski resorts"
Beijing,November,Gastronomic,9,"Peking duck, street food, diverse cuisine"
Beijing,November,Wellness and Spa,5,Some luxury hotels and traditional Chinese medicine centers
Beijing,November,Festival and Events,7,"Local cultural events, fewer major festivals"
Beijing,November,Ecotourism,4,"Limited, some parks and nature reserves"
Beijing,November,Historical and Heritage,10,"Forbidden City, Temple of Heaven, Summer Palace"
Beijing,November,Art and Design,8,"798 Art District, traditional Chinese art"
Beijing,November,Photography,9,"Iconic landmarks, autumn foliage"
Beijing,November,Family Fun,7,"Beijing Zoo, parks, museums"
Beijing,November,Romantic Getaways,6,"Scenic spots, luxury hotels"
Beijing,November,Fitness and Active,6,"Parks, hiking, local fitness centers"
Beijing,December,Adventure,6,"Great Wall hiking, local tours"
Beijing,December,Cruise,2,"Limited options, some river cruises"
Beijing,December,Winter Sports,4,"Nearby ski resorts, but not a primary destination for winter sports"
Beijing,December,Gastronomic,9,"Peking duck, street food, diverse cuisine"
Beijing,December,Wellness and Spa,5,Some luxury hotels with spa services
Beijing,December,Festival and Events,7,"Christmas markets, local winter festivals"
Beijing,December,Ecotourism,3,"Limited options within the city, some nearby nature reserves"
Beijing,December,Historical and Heritage,10,"Forbidden City, Temple of Heaven, Great Wall"
Beijing,December,Art and Design,8,"798 Art District, numerous galleries and museums"
Beijing,December,Photography,9,"Iconic landmarks, winter scenery, vibrant street life"
Beijing,December,Family Fun,7,"Beijing Zoo, parks, cultural experiences"
Beijing,December,Romantic Getaways,6,"Scenic spots, luxury hotels, historical sites"
Beijing,December,Fitness and Active,6,"Parks for jogging, local fitness centers, hiking opportunities"
Guangzhou,January,Adventure,6,"Hiking in Baiyun Mountain, exploring Shamian Island"
Guangzhou,January,Cruise,5,Pearl River night cruises
Guangzhou,January,Winter Sports,2,"Limited options, indoor ice skating rinks"
Guangzhou,January,Gastronomic,9,"Cantonese cuisine, street food, dim sum"
Guangzhou,January,Wellness and Spa,7,Numerous spas and wellness centers
Guangzhou,January,Festival and Events,8,"Chinese New Year preparations, Flower Fairs"
Guangzhou,January,Ecotourism,6,"Baiyun Mountain, South China Botanical Garden"
Guangzhou,January,Historical and Heritage,8,"Chen Clan Ancestral Hall, Sun Yat-sen Memorial Hall"
Guangzhou,January,Art and Design,7,"Guangzhou Opera House, Redtory Art & Design Factory"
Guangzhou,January,Photography,7,"Canton Tower, Shamian Island, traditional markets"
Guangzhou,January,Family Fun,7,"Chimelong Paradise, Guangzhou Zoo"
Guangzhou,January,Romantic Getaways,6,"Pearl River night cruises, Yuexiu Park"
Guangzhou,January,Fitness and Active,6,"Parks, hiking trails, fitness centers"
Guangzhou,February,Adventure,5,"Hiking in Baiyun Mountain, exploring urban parks"
Guangzhou,February,Cruise,4,Pearl River night cruises
Guangzhou,February,Winter Sports,2,"Limited options, indoor ice skating rinks"
Guangzhou,February,Gastronomic,9,"Cantonese cuisine, street food, dim sum"
Guangzhou,February,Wellness and Spa,6,Various spas and wellness centers
Guangzhou,February,Festival and Events,8,"Chinese New Year celebrations, Lantern Festival"
Guangzhou,February,Ecotourism,5,"South China Botanical Garden, Baiyun Mountain"
Guangzhou,February,Historical and Heritage,7,"Chen Clan Ancestral Hall, Shamian Island, Temple of the Six Banyan Trees"
Guangzhou,February,Art and Design,6,"Guangzhou Opera House, Redtory Art & Design Factory"
Guangzhou,February,Photography,7,"Scenic spots, traditional architecture, urban landscapes"
Guangzhou,February,Family Fun,6,"Chimelong Paradise, Guangzhou Zoo, parks"
Guangzhou,February,Romantic Getaways,5,"Pearl River night cruise, Yuexiu Park"
Guangzhou,February,Fitness and Active,6,"Urban parks, gyms, hiking trails"
Guangzhou,March,Adventure,6,"Hiking in Baiyun Mountain, exploring Chimelong Safari Park"
Guangzhou,March,Cruise,5,Pearl River night cruises
Guangzhou,March,Winter Sports,2,"Limited options, indoor ice skating"
Guangzhou,March,Gastronomic,9,"Cantonese cuisine, street food, dim sum"
Guangzhou,March,Wellness and Spa,7,Numerous spas and wellness centers
Guangzhou,March,Festival and Events,8,"Guangzhou International Light Festival, Flower Fairs"
Guangzhou,March,Ecotourism,6,"South China Botanical Garden, Baiyun Mountain"
Guangzhou,March,Historical and Heritage,8,"Chen Clan Ancestral Hall, Shamian Island, Temple of the Six Banyan Trees"
Guangzhou,March,Art and Design,7,"Guangzhou Opera House, Redtory Art & Design Factory"
Guangzhou,March,Photography,8,"Canton Tower, Shamian Island, Pearl River"
Guangzhou,March,Family Fun,7,"Chimelong Paradise, Guangzhou Zoo"
Guangzhou,March,Romantic Getaways,6,"Pearl River night cruise, Baiyun Mountain"
Guangzhou,March,Fitness and Active,6,"Parks, hiking trails, fitness centers"
Guangzhou,April,Adventure,6,"Hiking in Baiyun Mountain, Chimelong Paradise theme park"
Guangzhou,April,Cruise,4,Pearl River night cruise
Guangzhou,April,Winter Sports,1,"Limited options, indoor ice skating"
Guangzhou,April,Gastronomic,9,"Cantonese cuisine, street food, dim sum"
Guangzhou,April,Wellness and Spa,7,"High-end spas, traditional Chinese medicine treatments"
Guangzhou,April,Festival and Events,8,"Canton Fair, Qingming Festival"
Guangzhou,April,Ecotourism,5,"South China Botanical Garden, Baiyun Mountain"
Guangzhou,April,Historical and Heritage,8,"Chen Clan Ancestral Hall, Shamian Island, Temple of the Six Banyan Trees"
Guangzhou,April,Art and Design,7,"Guangzhou Opera House, Redtory Art & Design Factory"
Guangzhou,April,Photography,7,"Canton Tower, Shamian Island, Pearl River"
Guangzhou,April,Family Fun,8,"Chimelong Safari Park, Chimelong Paradise, Guangzhou Zoo"
Guangzhou,April,Romantic Getaways,6,"Pearl River night cruise, Baiyun Mountain"
Guangzhou,April,Fitness and Active,6,"Hiking, parks, fitness centers"
Guangzhou,May,Adventure,6,"Hiking in Baiyun Mountain, water sports in Chimelong Water Park"
Guangzhou,May,Cruise,5,Pearl River night cruise
Guangzhou,May,Winter Sports,0,Not applicable
Guangzhou,May,Gastronomic,9,"Cantonese cuisine, street food, dim sum"
Guangzhou,May,Wellness and Spa,7,"Luxury spas in high-end hotels, traditional Chinese medicine treatments"
Guangzhou,May,Festival and Events,8,"Dragon Boat Festival, Canton Fair"
Guangzhou,May,Ecotourism,6,"South China Botanical Garden, Baiyun Mountain"
Guangzhou,May,Historical and Heritage,8,"Chen Clan Ancestral Hall, Shamian Island, Temple of the Six Banyan Trees"
Guangzhou,May,Art and Design,7,"Guangzhou Opera House, Guangdong Museum"
Guangzhou,May,Photography,7,"Canton Tower, Shamian Island, Pearl River"
Guangzhou,May,Family Fun,8,"Chimelong Safari Park, Chimelong Paradise"
Guangzhou,May,Romantic Getaways,6,"Pearl River night cruise, Yuexiu Park"
Guangzhou,May,Fitness and Active,7,"Hiking, cycling, fitness centers"
Guangzhou,June,Adventure,6,"Hiking in Baiyun Mountain, exploring Chimelong Safari Park"
Guangzhou,June,Cruise,4,Pearl River night cruises
Guangzhou,June,Winter Sports,0,Not applicable
Guangzhou,June,Gastronomic,9,"Cantonese cuisine, street food, dim sum"
Guangzhou,June,Wellness and Spa,5,Various spas and wellness centers
Guangzhou,June,Festival and Events,7,"Dragon Boat Festival, local cultural events"
Guangzhou,June,Ecotourism,6,"Baiyun Mountain, South China Botanical Garden"
Guangzhou,June,Historical and Heritage,8,"Chen Clan Ancestral Hall, Shamian Island, Temple of the Six Banyan Trees"
Guangzhou,June,Art and Design,7,"Guangzhou Opera House, Redtory Art & Design Factory"
Guangzhou,June,Photography,7,"Canton Tower, Shamian Island, Pearl River"
Guangzhou,June,Family Fun,8,"Chimelong Paradise, Guangzhou Zoo, Chimelong Water Park"
Guangzhou,June,Romantic Getaways,6,"Pearl River night cruise, Canton Tower"
Guangzhou,June,Fitness and Active,6,"Hiking, parks, fitness centers"
Guangzhou,July,Adventure,6,"Hiking in Baiyun Mountain, water sports in Chimelong Water Park"
Guangzhou,July,Cruise,5,Pearl River night cruises
Guangzhou,July,Winter Sports,0,Not applicable
Guangzhou,July,Gastronomic,9,"Cantonese cuisine, street food, dim sum"
Guangzhou,July,Wellness and Spa,7,"Luxury spas, traditional Chinese medicine treatments"
Guangzhou,July,Festival and Events,8,"Guangzhou International Food Festival, Dragon Boat Festival"
Guangzhou,July,Ecotourism,6,"South China Botanical Garden, Baiyun Mountain"
Guangzhou,July,Historical and Heritage,8,"Chen Clan Ancestral Hall, Shamian Island, Temple of the Six Banyan Trees"
Guangzhou,July,Art and Design,7,"Guangzhou Opera House, Guangdong Museum of Art"
Guangzhou,July,Photography,7,"Canton Tower, Shamian Island, Pearl River"
Guangzhou,July,Family Fun,8,"Chimelong Safari Park, Chimelong Paradise, Guangzhou Zoo"
Guangzhou,July,Romantic Getaways,6,"Pearl River night cruises, Yuexiu Park"
Guangzhou,July,Fitness and Active,7,"Hiking, cycling, fitness centers"
Guangzhou,August,Adventure,6,"Hiking in Baiyun Mountain, Chimelong Safari Park"
Guangzhou,August,Cruise,4,Pearl River Night Cruise
Guangzhou,August,Winter Sports,0,Not applicable in August
Guangzhou,August,Gastronomic,9,"Cantonese cuisine, Dim Sum, Local street food"
Guangzhou,August,Wellness and Spa,7,Numerous luxury spas and wellness centers
Guangzhou,August,Festival and Events,5,"Local cultural events, Mid-Autumn Festival preparations"
Guangzhou,August,Ecotourism,6,"Baiyun Mountain, South China Botanical Garden"
Guangzhou,August,Historical and Heritage,8,"Chen Clan Ancestral Hall, Shamian Island, Temple of the Six Banyan Trees"
Guangzhou,August,Art and Design,7,"Guangzhou Opera House, Guangdong Museum"
Guangzhou,August,Photography,7,"Canton Tower, Shamian Island, Pearl River"
Guangzhou,August,Family Fun,8,"Chimelong Paradise, Guangzhou Zoo, Chimelong Safari Park"
Guangzhou,August,Romantic Getaways,6,"Pearl River Night Cruise, Canton Tower"
Guangzhou,August,Fitness and Active,6,"Parks, hiking trails, fitness centers"
Guangzhou,September,Adventure,6,"Hiking in Baiyun Mountain, Chimelong Paradise theme park"
Guangzhou,September,Cruise,4,Pearl River night cruise
Guangzhou,September,Winter Sports,0,Not applicable
Guangzhou,September,Gastronomic,9,"Cantonese cuisine, street food, dim sum"
Guangzhou,September,Wellness and Spa,7,Numerous spas and wellness centers
Guangzhou,September,Festival and Events,8,"Mid-Autumn Festival, Guangzhou International Shopping Festival"
Guangzhou,September,Ecotourism,5,"South China Botanical Garden, Baiyun Mountain"
Guangzhou,September,Historical and Heritage,8,"Chen Clan Ancestral Hall, Shamian Island, Temple of the Six Banyan Trees"
Guangzhou,September,Art and Design,7,"Guangzhou Opera House, Guangdong Museum"
Guangzhou,September,Photography,7,"Canton Tower, Shamian Island, Pearl River"
Guangzhou,September,Family Fun,8,"Chimelong Safari Park, Chimelong Paradise, Guangzhou Zoo"
Guangzhou,September,Romantic Getaways,6,"Pearl River night cruise, Canton Tower"
Guangzhou,September,Fitness and Active,6,"Hiking, parks, fitness centers"
Guangzhou,October,Adventure,6,"Hiking in Baiyun Mountain, Water sports in Chimelong Water Park"
Guangzhou,October,Cruise,4,Pearl River Night Cruise
Guangzhou,October,Winter Sports,0,Not applicable
Guangzhou,October,Gastronomic,9,"Cantonese cuisine, Dim Sum, Local street food"
Guangzhou,October,Wellness and Spa,7,"High-end spas, Traditional Chinese medicine treatments"
Guangzhou,October,Festival and Events,8,"Mid-Autumn Festival, Canton Fair"
Guangzhou,October,Ecotourism,5,"South China Botanical Garden, Baiyun Mountain"
Guangzhou,October,Historical and Heritage,8,"Chen Clan Ancestral Hall, Shamian Island, Sun Yat-sen Memorial Hall"
Guangzhou,October,Art and Design,7,"Guangzhou Opera House, Redtory Art & Design Factory"
Guangzhou,October,Photography,7,"Canton Tower, Shamian Island, Yuexiu Park"
Guangzhou,October,Family Fun,8,"Chimelong Safari Park, Chimelong Paradise"
Guangzhou,October,Romantic Getaways,6,"Pearl River Night Cruise, Canton Tower"
Guangzhou,October,Fitness and Active,6,"Hiking, Cycling paths, Fitness centers"
Guangzhou,November,Adventure,6,"Hiking in Baiyun Mountain, exploring Chimelong Safari Park"
Guangzhou,November,Cruise,4,Pearl River night cruise
Guangzhou,November,Winter Sports,2,"Limited options, indoor ice skating rinks"
Guangzhou,November,Gastronomic,9,"Cantonese cuisine, street food, dim sum"
Guangzhou,November,Wellness and Spa,7,Numerous high-end spas and wellness centers
Guangzhou,November,Festival and Events,8,"Guangzhou International Light Festival, Canton Fair"
Guangzhou,November,Ecotourism,5,"South China Botanical Garden, Baiyun Mountain"
Guangzhou,November,Historical and Heritage,7,"Chen Clan Ancestral Hall, Shamian Island"
Guangzhou,November,Art and Design,6,"Guangzhou Opera House, Redtory Art & Design Factory"
Guangzhou,November,Photography,7,"Canton Tower, Shamian Island, Pearl River"
Guangzhou,November,Family Fun,8,"Chimelong Paradise, Guangzhou Zoo, Pearl River cruise"
Guangzhou,November,Romantic Getaways,6,"Pearl River night cruise, Baiyun Mountain"
Guangzhou,November,Fitness and Active,6,"Parks, hiking trails, fitness centers"
Guangzhou,December,Adventure,6,"Hiking in Baiyun Mountain, exploring Chimelong Safari Park"
Guangzhou,December,Cruise,4,Pearl River night cruises
Guangzhou,December,Winter Sports,2,"Limited options, indoor ice skating rinks"
Guangzhou,December,Gastronomic,9,"Cantonese cuisine, street food, fine dining"
Guangzhou,December,Wellness and Spa,7,Numerous high-end spas and wellness centers
Guangzhou,December,Festival and Events,8,"Guangzhou International Light Festival, Christmas markets"
Guangzhou,December,Ecotourism,5,"South China Botanical Garden, Baiyun Mountain"
Guangzhou,December,Historical and Heritage,8,"Chen Clan Ancestral Hall, Shamian Island, Temple of the Six Banyan Trees"
Guangzhou,December,Art and Design,7,"Guangzhou Opera House, Guangdong Museum"
Guangzhou,December,Photography,7,"Canton Tower, Shamian Island, Pearl River"
Guangzhou,December,Family Fun,8,"Chimelong Paradise, Guangzhou Zoo, Science City"
Guangzhou,December,Romantic Getaways,6,"Pearl River night cruises, Yuexiu Park"
Guangzhou,December,Fitness and Active,6,"Parks, hiking trails, fitness centers"
Dalian,January,Adventure,5,"Coastal activities, hiking (limited due to winter)"
Dalian,January,Cruise,3,Limited cruise options in winter
Dalian,January,Winter Sports,4,Some ice skating and limited skiing options
Dalian,January,Gastronomic,7,"Seafood, local cuisine, winter specialties"
Dalian,January,Wellness and Spa,6,Several spas and wellness centers
Dalian,January,Festival and Events,4,"Limited events, some local winter festivals"
Dalian,January,Ecotourism,5,"Nature parks, but limited activities due to cold weather"
Dalian,January,Historical and Heritage,6,"Historical sites, museums"
Dalian,January,Art and Design,5,"Art galleries, local crafts"
Dalian,January,Photography,6,"Scenic coastal views, winter landscapes"
