Destination,Month,Category,Score,Options
Dalian,January,Family Fun,5,"Indoor activities, limited outdoor options due to cold"
Dalian,January,Romantic Getaways,6,"Coastal views, cozy winter settings"
Dalian,January,Fitness and Active,5,"Indoor gyms, limited outdoor activities"
Dalian,February,Adventure,5,"Coastal hiking, scenic parks"
Dalian,February,Cruise,3,Limited cruise options due to winter season
Dalian,February,Winter Sports,4,"Some ice skating and winter activities, but not a major winter sports hub"
Dalian,February,Gastronomic,7,"Fresh seafood, local cuisine"
Dalian,February,Wellness and Spa,6,Several spas and wellness centers
Dalian,February,Festival and Events,4,Limited events in February
Dalian,February,Ecotourism,5,Coastal and natural parks
Dalian,February,Historical and Heritage,6,"Historical sites, museums"
Dalian,February,Art and Design,5,"Local art galleries, modern architecture"
Dalian,February,Photography,6,"Scenic coastal views, urban landscapes"
Dalian,February,Family Fun,5,"Parks, aquariums, family-friendly attractions"
Dalian,February,Romantic Getaways,6,"Coastal views, romantic dining options"
Dalian,February,Fitness and Active,5,"Parks, walking trails, fitness centers"
Dalian,March,Adventure,6,"Hiking, coastal activities, scenic parks"
Dalian,March,Cruise,7,"Port city with cruise options, coastal views"
Dalian,March,Winter Sports,3,"Limited options, some indoor skating rinks"
Dalian,March,Gastronomic,8,"Seafood, local cuisine, diverse dining options"
Dalian,March,Wellness and Spa,7,Several spas and wellness centers
Dalian,March,Festival and Events,5,"Limited events in March, some local cultural activities"
Dalian,March,Ecotourism,6,"Coastal parks, nature reserves"
Dalian,March,Historical and Heritage,7,"Historical sites, museums, Russian and Japanese architectural influences"
Dalian,March,Art and Design,6,"Art galleries, modern architecture"
Dalian,March,Photography,8,"Scenic coastal views, urban landscapes, historical sites"
Dalian,March,Family Fun,7,"Parks, aquariums, family-friendly attractions"
Dalian,March,Romantic Getaways,7,"Coastal walks, scenic spots, romantic dining"
Dalian,March,Fitness and Active,6,"Parks, fitness centers, outdoor activities"
Dalian,April,Adventure,6,"Hiking, coastal activities, scenic parks"
Dalian,April,Cruise,7,"Coastal cruises, ferry rides"
Dalian,April,Winter Sports,1,"Limited options, not the season for winter sports"
Dalian,April,Gastronomic,8,"Seafood, local cuisine, street food"
Dalian,April,Wellness and Spa,6,"Spas, hot springs, wellness centers"
Dalian,April,Festival and Events,5,"Local cultural events, spring festivals"
Dalian,April,Ecotourism,7,"Nature reserves, coastal ecosystems, bird watching"
Dalian,April,Historical and Heritage,6,"Historical sites, museums, colonial architecture"
Dalian,April,Art and Design,5,"Art galleries, modern architecture"
Dalian,April,Photography,7,"Scenic coastal views, parks, cityscapes"
Dalian,April,Family Fun,7,"Parks, aquariums, family-friendly attractions"
Dalian,April,Romantic Getaways,6,"Coastal walks, scenic spots, romantic dining"
Dalian,April,Fitness and Active,6,"Outdoor activities, parks, fitness centers"
Dalian,May,Adventure,7,"Hiking, coastal activities, water sports"
Dalian,May,Cruise,8,"Dalian Port, coastal cruises, ferry rides"
Dalian,May,Winter Sports,0,Not applicable in May
Dalian,May,Gastronomic,9,"Seafood, local cuisine, street food"
Dalian,May,Wellness and Spa,6,"Spas, wellness centers, beach resorts"
Dalian,May,Festival and Events,7,"Dalian International Walking Festival, local cultural events"
Dalian,May,Ecotourism,6,"Forest parks, coastal nature reserves"
Dalian,May,Historical and Heritage,5,"Russian Street, Dalian Modern Museum"
Dalian,May,Art and Design,6,"Dalian Art Museum, local galleries"
Dalian,May,Photography,8,"Scenic coastal views, urban landscapes, parks"
Dalian,May,Family Fun,7,"Dalian Discovery Kingdom, beaches, parks"
Dalian,May,Romantic Getaways,7,"Coastal resorts, scenic spots, romantic dining"
Dalian,May,Fitness and Active,7,"Hiking trails, cycling routes, outdoor fitness parks"
Dalian,June,Adventure,7,"Hiking, beach activities, water sports"
Dalian,June,Cruise,8,"Coastal cruises, ferry rides"
Dalian,June,Winter Sports,0,Not applicable in June
Dalian,June,Gastronomic,8,"Seafood, local cuisine, street food"
Dalian,June,Wellness and Spa,6,"Spa resorts, wellness centers"
Dalian,June,Festival and Events,7,"Dalian International Beer Festival (late July, but preparations start)"
Dalian,June,Ecotourism,6,"Coastal parks, nature reserves"
Dalian,June,Historical and Heritage,5,"Historical sites, museums"
Dalian,June,Art and Design,6,"Art galleries, modern architecture"
Dalian,June,Photography,8,"Scenic coastal views, urban landscapes"
Dalian,June,Family Fun,7,"Beaches, amusement parks, aquariums"
Dalian,June,Romantic Getaways,7,"Scenic spots, romantic beaches"
Dalian,June,Fitness and Active,7,"Outdoor activities, parks, fitness centers"
Dalian,July,Adventure,7,"Hiking, water sports, coastal activities"
Dalian,July,Cruise,8,"Coastal cruises, ferry rides"
Dalian,July,Winter Sports,0,Not applicable in July
Dalian,July,Gastronomic,8,"Seafood, local cuisine, night markets"
Dalian,July,Wellness and Spa,6,"Spas, wellness centers"
Dalian,July,Festival and Events,7,"Dalian International Beer Festival, local cultural events"
Dalian,July,Ecotourism,6,"Forest parks, coastal reserves"
Dalian,July,Historical and Heritage,5,"Historical sites, museums"
Dalian,July,Art and Design,5,"Art galleries, modern architecture"
Dalian,July,Photography,8,"Scenic coastal views, urban landscapes"
Dalian,July,Family Fun,7,"Beaches, amusement parks, zoos"
Dalian,July,Romantic Getaways,7,"Beachfront resorts, scenic spots"
Dalian,July,Fitness and Active,7,"Outdoor activities, parks, fitness centers"
Dalian,August,Adventure,7,"Hiking, water sports, beach activities"
Dalian,August,Cruise,8,"Coastal cruises, ferry rides"
Dalian,August,Winter Sports,0,Not applicable in August
Dalian,August,Gastronomic,8,"Seafood, local cuisine, night markets"
Dalian,August,Wellness and Spa,6,"Spa resorts, wellness centers"
Dalian,August,Festival and Events,7,"Dalian International Beer Festival, local cultural events"
Dalian,August,Ecotourism,6,"Coastal parks, nature reserves"
Dalian,August,Historical and Heritage,5,"Historical sites, museums"
Dalian,August,Art and Design,5,"Art galleries, modern architecture"
Dalian,August,Photography,8,"Scenic coastal views, urban landscapes, cultural festivals"
Dalian,August,Family Fun,7,"Beaches, amusement parks, family-friendly attractions"
Dalian,August,Romantic Getaways,7,"Scenic spots, romantic beaches, sunset views"
Dalian,August,Fitness and Active,7,"Outdoor activities, beach sports, hiking trails"
Dalian,September,Adventure,7,"Hiking, coastal activities, water sports"
Dalian,September,Cruise,8,"Coastal cruises, ferry rides"
Dalian,September,Winter Sports,0,Not applicable in September
Dalian,September,Gastronomic,8,"Seafood, local cuisine, street food"
Dalian,September,Wellness and Spa,6,"Spa resorts, wellness centers"
Dalian,September,Festival and Events,7,"Dalian International Fashion Festival, local cultural events"
Dalian,September,Ecotourism,6,"Coastal parks, nature reserves"
Dalian,September,Historical and Heritage,5,"Historical sites, museums"
Dalian,September,Art and Design,6,"Art galleries, modern architecture"
Dalian,September,Photography,8,"Scenic coastal views, urban landscapes"
Dalian,September,Family Fun,7,"Theme parks, beaches, family-friendly attractions"
Dalian,September,Romantic Getaways,7,"Scenic spots, romantic dining options"
Dalian,September,Fitness and Active,7,"Outdoor activities, fitness centers, parks"
Dalian,October,Adventure,7,"Hiking, coastal activities, water sports"
Dalian,October,Cruise,8,Port city with various cruise options
Dalian,October,Winter Sports,2,"Limited options, not the season for winter sports"
Dalian,October,Gastronomic,8,"Seafood, local cuisine, street food"
Dalian,October,Wellness and Spa,6,Several spas and wellness centers
Dalian,October,Festival and Events,7,"Dalian International Fashion Festival, local cultural events"
Dalian,October,Ecotourism,6,"Coastal parks, nature reserves"
Dalian,October,Historical and Heritage,5,"Some historical sites, but not a primary focus"
Dalian,October,Art and Design,6,"Art galleries, modern architecture"
Dalian,October,Photography,8,"Scenic coastal views, urban landscapes"
Dalian,October,Family Fun,7,"Parks, beaches, family-friendly attractions"
Dalian,October,Romantic Getaways,7,"Scenic spots, romantic coastal walks"
Dalian,October,Fitness and Active,7,"Outdoor activities, fitness centers, parks"
Dalian,November,Adventure,6,"Hiking, coastal activities"
Dalian,November,Cruise,7,Port city with cruise options
Dalian,November,Winter Sports,3,"Limited options, not a primary destination for winter sports"
Dalian,November,Gastronomic,8,"Seafood, local cuisine"
Dalian,November,Wellness and Spa,6,Several spas and wellness centers
Dalian,November,Festival and Events,5,"Some local events, but not a peak season for festivals"
Dalian,November,Ecotourism,7,"Coastal parks, nature reserves"
Dalian,November,Historical and Heritage,6,"Historical sites, museums"
Dalian,November,Art and Design,5,Some galleries and public art
Dalian,November,Photography,7,"Scenic coastal views, urban landscapes"
Dalian,November,Family Fun,7,"Parks, aquariums, family-friendly attractions"
Dalian,November,Romantic Getaways,6,"Coastal scenery, romantic spots"
Dalian,November,Fitness and Active,6,"Outdoor activities, fitness centers"
Dalian,December,Adventure,5,"Coastal activities, hiking (weather permitting)"
Dalian,December,Cruise,4,Limited due to winter season
Dalian,December,Winter Sports,3,Not a primary destination for winter sports
Dalian,December,Gastronomic,7,"Seafood, local cuisine, winter specialties"
Dalian,December,Wellness and Spa,6,Several spas and wellness centers available
Dalian,December,Festival and Events,5,Some local winter festivals and events
Dalian,December,Ecotourism,4,Limited due to winter season
Dalian,December,Historical and Heritage,6,Historical sites and museums
Dalian,December,Art and Design,5,Art galleries and cultural centers
Dalian,December,Photography,6,"Scenic coastal views, cityscapes"
Dalian,December,Family Fun,6,"Indoor attractions, parks, and family-friendly activities"
Dalian,December,Romantic Getaways,7,"Coastal views, romantic spots, winter ambiance"
Dalian,December,Fitness and Active,5,"Indoor fitness centers, limited outdoor activities due to weather"
Hangzhou,January,Adventure,5,"Hiking in tea plantations, exploring West Lake"
Hangzhou,January,Cruise,6,Boat tours on West Lake
Hangzhou,January,Winter Sports,2,"Limited options, not a primary destination for winter sports"
Hangzhou,January,Gastronomic,8,"Famous for Hangzhou cuisine, tea culture"
Hangzhou,January,Wellness and Spa,7,Numerous wellness resorts and traditional Chinese medicine treatments
Hangzhou,January,Festival and Events,4,"Fewer events in January, but some local cultural activities"
Hangzhou,January,Ecotourism,6,"Tea plantations, botanical gardens"
Hangzhou,January,Historical and Heritage,9,"Rich history, temples, pagodas, ancient streets"
Hangzhou,January,Art and Design,7,"Traditional Chinese art, silk, and crafts"
Hangzhou,January,Photography,8,"Scenic landscapes, historical sites, West Lake"
Hangzhou,January,Family Fun,6,"Parks, museums, family-friendly attractions"
Hangzhou,January,Romantic Getaways,8,"Scenic spots, boat rides, serene environment"
Hangzhou,January,Fitness and Active,5,"Hiking, walking tours, some fitness facilities"
Hangzhou,February,Adventure,5,"Hiking in tea plantations, exploring West Lake"
Hangzhou,February,Cruise,6,Boat rides on West Lake
Hangzhou,February,Winter Sports,2,"Limited options, not a primary destination for winter sports"
Hangzhou,February,Gastronomic,8,"Famous for Longjing tea, Hangzhou cuisine, street food"
Hangzhou,February,Wellness and Spa,7,"Numerous spas and wellness centers, traditional Chinese medicine"
Hangzhou,February,Festival and Events,4,"Chinese New Year celebrations, but fewer major events in February"
Hangzhou,February,Ecotourism,6,"Tea plantations, botanical gardens, scenic natural spots"
Hangzhou,February,Historical and Heritage,9,"Lingyin Temple, ancient pagodas, traditional architecture"
Hangzhou,February,Art and Design,7,"Museums, traditional Chinese art, silk markets"
Hangzhou,February,Photography,8,"Scenic West Lake, historical sites, natural beauty"
Hangzhou,February,Family Fun,6,"Parks, boat rides, family-friendly attractions"
Hangzhou,February,Romantic Getaways,8,"Scenic spots, boat rides, romantic walks around West Lake"
Hangzhou,February,Fitness and Active,5,"Hiking, walking tours, limited winter sports"
Hangzhou,March,Adventure,6,"Hiking in tea plantations, exploring West Lake"
Hangzhou,March,Cruise,7,Boat rides on West Lake
Hangzhou,March,Winter Sports,2,"Limited options, not a primary destination for winter sports"
Hangzhou,March,Gastronomic,9,"Renowned for Hangzhou cuisine, tea culture, and local delicacies"
Hangzhou,March,Wellness and Spa,8,Numerous luxury spas and wellness retreats
Hangzhou,March,Festival and Events,7,"Plum Blossom Festival, local cultural events"
Hangzhou,March,Ecotourism,8,"Tea plantations, botanical gardens, scenic natural spots"
Hangzhou,March,Historical and Heritage,9,"Lingyin Temple, ancient pagodas, historical streets"
Hangzhou,March,Art and Design,7,"Traditional Chinese art, silk, and crafts"
Hangzhou,March,Photography,9,"Scenic West Lake, blooming flowers, historical sites"
Hangzhou,March,Family Fun,7,"Parks, boat rides, cultural experiences suitable for families"
Hangzhou,March,Romantic Getaways,9,"Scenic spots, boat rides, romantic ambiance around West Lake"
Hangzhou,March,Fitness and Active,7,"Hiking, cycling, and walking trails"
Hangzhou,April,Adventure,6,"Hiking in tea plantations, cycling around West Lake"
Hangzhou,April,Cruise,8,"Boat rides on West Lake, Grand Canal cruises"
Hangzhou,April,Winter Sports,0,Not applicable
Hangzhou,April,Gastronomic,9,"Local cuisine, tea tasting, street food"
Hangzhou,April,Wellness and Spa,7,"Traditional Chinese medicine, spa resorts"
Hangzhou,April,Festival and Events,8,"Qingming Festival, West Lake International Expo"
Hangzhou,April,Ecotourism,7,"Xixi National Wetland Park, tea plantations"
Hangzhou,April,Historical and Heritage,9,"Lingyin Temple, Leifeng Pagoda, ancient streets"
Hangzhou,April,Art and Design,7,"China Academy of Art, local crafts, silk markets"
Hangzhou,April,Photography,9,"Scenic West Lake, traditional architecture, blooming flowers"
Hangzhou,April,Family Fun,8,"Hangzhou Zoo, amusement parks, boat rides"
Hangzhou,April,Romantic Getaways,9,"West Lake, romantic boat rides, scenic spots"
Hangzhou,April,Fitness and Active,7,"Hiking, cycling, rowing on West Lake"
Hangzhou,May,Adventure,6,"Hiking in tea plantations, cycling around West Lake"
Hangzhou,May,Cruise,7,Boat rides on West Lake
Hangzhou,May,Winter Sports,0,Not applicable
Hangzhou,May,Gastronomic,9,"Local cuisine, tea culture, street food"
Hangzhou,May,Wellness and Spa,8,"Traditional Chinese medicine, spa resorts"
Hangzhou,May,Festival and Events,7,"Dragon Boat Festival, tea picking season"
Hangzhou,May,Ecotourism,8,"Xixi National Wetland Park, tea plantations"
Hangzhou,May,Historical and Heritage,9,"Lingyin Temple, Leifeng Pagoda, ancient streets"
Hangzhou,May,Art and Design,7,"Traditional Chinese art, silk production, museums"
Hangzhou,May,Photography,9,"Scenic West Lake, traditional architecture, natural landscapes"
Hangzhou,May,Family Fun,7,"Hangzhou Zoo, amusement parks, boat rides"
Hangzhou,May,Romantic Getaways,8,"West Lake, romantic boat rides, scenic spots"
Hangzhou,May,Fitness and Active,7,"Hiking, cycling, rowing"
Hangzhou,June,Adventure,6,"Hiking, cycling, water sports on West Lake"
Hangzhou,June,Cruise,8,Boat cruises on West Lake
Hangzhou,June,Winter Sports,0,Not applicable in June
Hangzhou,June,Gastronomic,9,"Local cuisine, tea culture, street food"
Hangzhou,June,Wellness and Spa,7,"Traditional Chinese medicine, spa resorts"
Hangzhou,June,Festival and Events,6,"Dragon Boat Festival (if it falls in June), local cultural events"
Hangzhou,June,Ecotourism,8,"Xixi National Wetland Park, tea plantations"
Hangzhou,June,Historical and Heritage,9,"Lingyin Temple, Leifeng Pagoda, ancient streets"
Hangzhou,June,Art and Design,7,"China Academy of Art, local galleries"
Hangzhou,June,Photography,9,"Scenic West Lake, traditional architecture, natural landscapes"
Hangzhou,June,Family Fun,7,"Parks, museums, boat rides"
Hangzhou,June,Romantic Getaways,8,"Scenic spots, boat rides, tea houses"
Hangzhou,June,Fitness and Active,7,"Hiking, cycling, water activities"
Hangzhou,July,Adventure,6,"Hiking, cycling around West Lake, water sports on Qiandao Lake"
Hangzhou,July,Cruise,7,"Boat tours on West Lake, Grand Canal cruises"
Hangzhou,July,Winter Sports,0,Not applicable in July
Hangzhou,July,Gastronomic,9,"Local cuisine, tea culture, street food"
Hangzhou,July,Wellness and Spa,8,"Luxury spas, traditional Chinese medicine treatments"
Hangzhou,July,Festival and Events,7,"Dragon Boat Festival, various cultural events"
Hangzhou,July,Ecotourism,8,"Xixi National Wetland Park, tea plantations, bamboo forests"
Hangzhou,July,Historical and Heritage,9,"Lingyin Temple, Leifeng Pagoda, ancient streets"
Hangzhou,July,Art and Design,7,"China Academy of Art, local crafts, silk markets"
Hangzhou,July,Photography,9,"Scenic West Lake, traditional architecture, natural landscapes"
Hangzhou,July,Family Fun,7,"Hangzhou Zoo, amusement parks, family-friendly parks"
Hangzhou,July,Romantic Getaways,9,"West Lake boat rides, romantic gardens, luxury resorts"
Hangzhou,July,Fitness and Active,7,"Jogging around West Lake, cycling, hiking trails"
Hangzhou,August,Adventure,6,"Hiking in tea plantations, cycling around West Lake"
Hangzhou,August,Cruise,7,Boat rides on West Lake
Hangzhou,August,Winter Sports,0,Not applicable
Hangzhou,August,Gastronomic,9,"Famous for Longjing tea, Hangzhou cuisine, street food"
Hangzhou,August,Wellness and Spa,8,"Numerous spas and wellness centers, traditional Chinese medicine"
Hangzhou,August,Festival and Events,6,"Various cultural events, though not peak festival season"
Hangzhou,August,Ecotourism,7,"Tea plantations, Xixi National Wetland Park"
Hangzhou,August,Historical and Heritage,9,"Lingyin Temple, Leifeng Pagoda, ancient streets"
Hangzhou,August,Art and Design,8,"China Academy of Art, various galleries and museums"
Hangzhou,August,Photography,9,"Scenic West Lake, traditional architecture, lush landscapes"
Hangzhou,August,Family Fun,7,"Parks, boat rides, cultural experiences"
Hangzhou,August,Romantic Getaways,8,"Scenic spots around West Lake, romantic boat rides"
Hangzhou,August,Fitness and Active,7,"Hiking, cycling, rowing"
Hangzhou,September,Adventure,6,"Hiking, cycling around West Lake, exploring tea plantations"
Hangzhou,September,Cruise,7,"Boat rides on West Lake, Grand Canal cruises"
Hangzhou,September,Winter Sports,0,Not applicable
Hangzhou,September,Gastronomic,9,"Local cuisine, tea culture, street food"
Hangzhou,September,Wellness and Spa,8,"Luxury spas, traditional Chinese medicine treatments"
Hangzhou,September,Festival and Events,7,"Mid-Autumn Festival, various cultural events"
Hangzhou,September,Ecotourism,8,"Tea plantations, botanical gardens, nature reserves"
Hangzhou,September,Historical and Heritage,9,"Lingyin Temple, Leifeng Pagoda, ancient streets"
Hangzhou,September,Art and Design,7,"Traditional Chinese art, contemporary galleries, silk markets"
Hangzhou,September,Photography,9,"Scenic West Lake, traditional architecture, natural landscapes"
Hangzhou,September,Family Fun,7,"Parks, museums, boat rides, Hangzhou Zoo"
Hangzhou,September,Romantic Getaways,9,"West Lake, romantic boat rides, scenic spots"
Hangzhou,September,Fitness and Active,7,"Hiking, cycling, rowing on West Lake"
Hangzhou,October,Adventure,6,"Hiking in tea plantations, cycling around West Lake"
Hangzhou,October,Cruise,8,"Boat rides on West Lake, Grand Canal cruises"
Hangzhou,October,Winter Sports,0,Not applicable
Hangzhou,October,Gastronomic,9,"Local cuisine, tea tasting, street food"
Hangzhou,October,Wellness and Spa,7,"Traditional Chinese medicine, spa resorts"
Hangzhou,October,Festival and Events,8,"Mid-Autumn Festival, Hangzhou International Marathon"
Hangzhou,October,Ecotourism,7,"Xixi National Wetland Park, tea plantations"
Hangzhou,October,Historical and Heritage,9,"Lingyin Temple, Leifeng Pagoda, ancient streets"
Hangzhou,October,Art and Design,7,"China Academy of Art, local crafts"
Hangzhou,October,Photography,9,"Scenic West Lake, traditional architecture, autumn foliage"
Hangzhou,October,Family Fun,7,"Hangzhou Zoo, amusement parks, family-friendly parks"
Hangzhou,October,Romantic Getaways,9,"West Lake, romantic boat rides, scenic spots"
Hangzhou,October,Fitness and Active,6,"Hiking, cycling, running trails"
Hangzhou,November,Adventure,6,"Hiking in tea plantations, exploring West Lake"
Hangzhou,November,Cruise,7,Boat rides on West Lake
Hangzhou,November,Winter Sports,2,"Limited options, not a primary destination for winter sports"
Hangzhou,November,Gastronomic,9,"Renowned for Hangzhou cuisine, tea culture"
Hangzhou,November,Wellness and Spa,8,"Numerous wellness retreats, traditional Chinese medicine spas"
Hangzhou,November,Festival and Events,5,"Some local events, but not peak festival season"
Hangzhou,November,Ecotourism,7,"Tea plantations, botanical gardens, scenic natural spots"
Hangzhou,November,Historical and Heritage,9,"Rich history, ancient temples, pagodas, traditional architecture"
Hangzhou,November,Art and Design,8,"Traditional Chinese art, silk, museums"
Hangzhou,November,Photography,9,"Scenic landscapes, historical sites, autumn foliage"
Hangzhou,November,Family Fun,7,"Parks, cultural experiences, family-friendly attractions"
Hangzhou,November,Romantic Getaways,8,"Scenic spots like West Lake, romantic boat rides"
Hangzhou,November,Fitness and Active,6,"Hiking, cycling, outdoor activities"
Hangzhou,December,Adventure,6,"Hiking, West Lake boat rides"
Hangzhou,December,Cruise,7,West Lake cruises
Hangzhou,December,Winter Sports,3,"Limited options, not a primary destination for winter sports"
Hangzhou,December,Gastronomic,9,"Renowned for local cuisine, tea culture, and street food"
Hangzhou,December,Wellness and Spa,8,Numerous high-quality spas and wellness centers
Hangzhou,December,Festival and Events,5,"Some local events, but not a peak season for festivals"
Hangzhou,December,Ecotourism,7,"Scenic natural spots like West Lake, tea plantations"
Hangzhou,December,Historical and Heritage,9,"Rich history, temples, pagodas, and ancient architecture"
Hangzhou,December,Art and Design,8,"Traditional Chinese art, silk, and modern design influences"
Hangzhou,December,Photography,9,"Picturesque landscapes, historical sites, and cultural scenes"
Hangzhou,December,Family Fun,7,"Family-friendly attractions like parks, museums, and boat rides"
Hangzhou,December,Romantic Getaways,8,"Scenic spots, romantic boat rides, and serene environments"
Hangzhou,December,Fitness and Active,6,"Opportunities for hiking, cycling, and walking tours"
Hong Kong,January,Adventure,7,"Hiking trails, rock climbing, water sports"
Hong Kong,January,Cruise,8,"Victoria Harbour cruises, Star Ferry"
Hong Kong,January,Winter Sports,2,"Limited options, indoor ice skating"
Hong Kong,January,Gastronomic,10,"Dim sum, street food, Michelin-starred restaurants"
Hong Kong,January,Wellness and Spa,7,"Luxury spas, traditional Chinese medicine"
Hong Kong,January,Festival and Events,9,"Chinese New Year celebrations, Hong Kong Arts Festival"
Hong Kong,January,Ecotourism,6,"Country parks, nature reserves, eco-tours"
Hong Kong,January,Historical and Heritage,8,"Temples, colonial architecture, museums"
Hong Kong,January,Art and Design,8,"Art galleries, street art, design districts"
Hong Kong,January,Photography,9,"Skyline, street scenes, natural landscapes"
Hong Kong,January,Family Fun,8,"Disneyland, Ocean Park, interactive museums"
Hong Kong,January,Romantic Getaways,7,"Scenic spots, luxury hotels, romantic dining"
Hong Kong,January,Fitness and Active,7,"Hiking, cycling, fitness centers"
Hong Kong,February,Adventure,7,"Hiking trails, rock climbing, water sports"
Hong Kong,February,Cruise,8,"Victoria Harbour cruises, Star Ferry"
Hong Kong,February,Winter Sports,2,"Limited options, indoor ice skating"
Hong Kong,February,Gastronomic,10,"Dim sum, street food, Michelin-starred restaurants"
Hong Kong,February,Wellness and Spa,7,"Luxury spas, traditional Chinese medicine treatments"
Hong Kong,February,Festival and Events,9,"Chinese New Year celebrations, Lantern Festival"
Hong Kong,February,Ecotourism,6,"Country parks, nature reserves, eco-tours"
Hong Kong,February,Historical and Heritage,8,"Temples, colonial architecture, museums"
Hong Kong,February,Art and Design,7,"Art galleries, street art, design districts"
Hong Kong,February,Photography,9,"Skyline, street scenes, cultural landmarks"
Hong Kong,February,Family Fun,8,"Disneyland, Ocean Park, interactive museums"
Hong Kong,February,Romantic Getaways,7,"Scenic spots, luxury hotels, romantic dining"
Hong Kong,February,Fitness and Active,7,"Outdoor activities, fitness centers, yoga studios"
Hong Kong,March,Adventure,7,"Hiking trails, rock climbing, water sports"
Hong Kong,March,Cruise,8,"Victoria Harbour cruises, Star Ferry"
Hong Kong,March,Winter Sports,1,"Limited options, no natural snow"
Hong Kong,March,Gastronomic,10,"Dim sum, street food, Michelin-starred restaurants"
Hong Kong,March,Wellness and Spa,7,"Luxury spas, wellness retreats"
Hong Kong,March,Festival and Events,9,"Hong Kong Arts Festival, International Film Festival"
Hong Kong,March,Ecotourism,6,"Country parks, nature reserves, eco-tours"
Hong Kong,March,Historical and Heritage,8,"Temples, colonial architecture, museums"
